{
  "contract": "stepmeld/workflow-definition.v1",
  "name": "workflowdef_hello",
  "version": 1,
  "label": "Hello: add two integers, then multiply the sum",
  "steps": [
    {"name": "add", "step": {"name": "stepdef_add", "version": 1}},
    {"name": "multiply", "step": {"name": "stepdef_multiply", "version": 1}}
  ],
  "bindings": [
    {"from": "add.sum", "to": "multiply.value"}
  ]
}
